{
  "schema_version": "1.0.0",
  "session_id": "synthetic-card-en-001",
  "created_at": "2026-07-15T00:00:00Z",
  "updated_at": "2026-07-15T00:00:00Z",
  "card": {
    "card_id": "SYNTHETIC-001",
    "name": "Synthetic Material Fixture",
    "set_code": "LAB",
    "rarity_label": "fixture",
    "language": "EN",
    "print_run": "synthetic",
    "finish_family_hypothesis": "sp-gold-ornamental"
  },
  "camera": {
    "operator": "GenkiStuff Lab",
    "camera_model": "fixture-camera",
    "lens": "fixture-lens",
    "focal_length_mm": 50,
    "camera_distance_mm": 500,
    "white_balance_kelvin": 5600,
    "exposure_locked": true,
    "focus_locked": true,
    "raw_available": false
  },
  "rights": {
    "owner": "GenkiStuff",
    "status": "owned-capture",
    "public_derivatives_allowed": true,
    "public_albedo_allowed": true,
    "license_reference": "synthetic fixture"
  },
  "authentication": {
    "status": "verified",
    "method": "synthetic fixture generated by the test suite",
    "verifier": "automated-fixture",
    "verified_at": "2026-07-15T00:00:00Z",
    "evidence_reference": "tests/test_geometry.py"
  },
  "files": []
}
